Pros and cons,"i purchased this mobile in 2022. If you are looking for gaming i phone then go for pro version of i phone 13 and 14 because there are frame drops issue and battery drain is fast like my poco f1 but still you can play bgmi nicely under fast network speed and low room temperature . BTW cemra and display quality is awesome specially video quality is amazing. Battery performance is not so good, overall performance and smoothness Is OP",64,RED,YES,4,Positive
A great smartphone!,"Loved this phone. Got it only for 45k during the sale.  Camera quality, built quality, everything is great. Though not fond of the battery backup, I guess that’s a problem with every iPhone.",64,RED,YES,4,Positive
Best Iphone,"Phones been amazingI have used iphone 4s , 5 , 6s and xr but I liked it.Long battery life, not quite as good as iPhone 13 but Close. Plus I didn’t like the weight and thickness of iPhone 13  just to get maybe 45-60 minutes more time at the most. I don’t see any difference in speed between Bionic14 and Bionic 15 what so ever. And to much hype for the 120 h refresh rate, no noticeable difference at all. Also I actually think iPhone 12 pictures look better than iPhone 13 because by supposedly having slight bit more detail they over saturate the black in them. Love the thin weightless feel in iPhone 12 and have had zero issues. I’m keeping this phone till the wheels fall off. Great value.",64,RED,YES,5,Positive
Super iPhone,Mobile is great and genuine. And  brand is brand fill with lot of features.which are not get in android’s. And after update added more.Camera quality is super…….battery is good for whole day with medium use.. light weight mobile..drawbacks-no fingerprint.no audio jack.only one physical sim slot. No charger. Cable is costly. Paid WhatsApp data transfer..upper status bar is smaller than android..Other than really satisfied with this iPhone 12…,64,RED,YES,5,Positive
If you get iphone 12 for around 42000 then go for it.,"I purchased iphone 12 in great Indian festival sale for 41500 excluding charger. Camera quality 5/5 , Battery 4.5/5(used you tube, Netflix, safari for anime, ig, whatsApp and battery lasted 1 1/2 day). Os is so smooth and easy to use. No blotware so big thumbs up. Got ios update16.1 . Build quality feels premium. (In hand use without back cover feels so good that i cannot explain). Iphone 12 is slightly lighter in weight.I even played apex legends and fps was constant, no lag,no heating issue. Hdr content is top notch. Plus it\'s 5g so I can easily use it for more than 5yrs.Overall after using iphone 12 for around 2months i can say it is worth it. Overall experience 5/5",64,RED,YES,5,Positive
Good,Good battery life,64,RED,YES,4,Positive
Camera quality,I have used pixel 3a in the past. Camera quality is not so good in indoor lighting,64,RED,YES,4.5,Positive
Iphone 12,Excellent phone. Battery back up is very good and fabulous camera. Excellent Sound quality. Very handy and less weighted phone.,64,RED,YES,5,Positive
How to decide between iPhone 11 and 12,"After thinking a lot, I decided to go ahead with iPhone 12. The original price is ₹ 84900. After credit card discount(₹6000), old phone exchange(₹3450) and reward points money(₹4530) inclusion, I bought it for ₹70920. There’s also an additional 3000 discount on red and white variants but I couldn’t let go of blue1. PRICE: Considering iPhone 11 would be supported by iOS for 4 years, based on the current price it’d cost 13k per year and iPhone 12 for 5 years would cost 14.9k(excluding exchange discount) per year. For me price gap for both phones didn’t seem to make a huge difference as IPhone 11 is already an year old and costing only a 2k less per year.2: DISPLAY: I’ve purchased iPhone 11 for my mom last year and been observing the display for some months. Compared to iPhone 11, the iPhone 12 display is far superior and has better pixel quality.3: BEZELS: the bezels of iPhone 12 are much thinner and makes the phone look decent unlike in 11. Apart from this, the phone is incredibly light making it easy to hold it.How to choose between 64/128gb:If you’re not really tight on budget, I’d suggest to go for 128gb variant. I’ve been using one plus for 1.5 years and storage  occupied about 60gb. So it’d make good sense to check your current phone usage. Either way you can also opt for iCloud 50gb storage which would cost approximately the difference amount of 64 and 128 go for 5 years.CONS:1. Could have definitely included the charger for the price2. If you’re an android user, migration would be little time consumingUpdate: I’ve uploaded a couple of pictures shot using automatic night mode. :)",64,RED,YES,5,Positive
Good and satisfactory upgrade for user having iphone series before 12,Face scan unlock is perfect,64,RED,YES,4,Positive
Good one,Value for money,64,RED,YES,4,Average
Its an iphone,Its an iphone and this statement is enough to explain it all,64,RED,YES,4.5,Average
Good camera,very good phone,64,RED,YES,3,Positive
An overpriced Average product,"I wanted to explore how good is Apple compared to Android. I must say the only good thing about this is consistency in both cameras and various different lightings. However on a number of occasions it does make you look darker than what ever you are. I find more cons tha pros so here is a list1. Network connectivity and wifi is not upto the mark. My OnePlus 9 pro will have better coverage with same wifi and network.2. At this exorbitant price, it\'s painful to see 60hz screen. You would find the scrolling painfully slow.3. Every accessory is expensive and the quality of these accesories is not something out of the world.4. The charging speed is really slow. Some claim fast chargers ruin the battery. But i had OnePlus phones easily lasting 3 plus of battery with fast charge. Have seen couple of iPhones draining battery within 2 years. My friends have iPhone 11 which i am referring to.5. Lack of customisation and the same boring look of the icons and you need to search numerous things to share anything.6. Face ID gets annoying at times. You need to also have other ways like fingerprint apart from passcode to unlock when u want to answer video calls.7. The nasty notch. I dont know if apple needs another decade to remove this. The new series pill shape is not either the best looking.8. Lock into the ecosystem and lack of flexibility.",64,RED,YES,5,Negative
Looks are Premium rest everything is Mediocre,The look of the phone is definitely great.The green one looks fantastic but rest everything is mediocre.The battery backup is really bad.The selfie camera is not upto the mark and couldn’t justify its price point.The only good thing about this phone is it will make you feel premium. The rear camera takes great photos. The processor is fast.Overall android at this price point makes a huge sense.,64,RED,YES,4,Positive
Iphone 12 Amazing Phone,"The phone is fabulous its amazingly smooth got this for ₹47,999 . 4GB 64GB Blue ColourHad To buy Charging Adapter For Another ₹1800Battery Backup is not that great & screen size seems small uograding from 6.6inch to 6.1inchThe worst part was the packaging they simply gave it in a amazon plastic package no bubble wrap, no hardboard covering packaging should be improved for item worth ₹48,000",64,RED,YES,4,Positive
Overall I am satisfied with the product,Overall I am satisfied with the product,64,RED,YES,4,Positive
Good purchase,Good for everything,64,RED,YES,4,Positive
Outstanding & Best selling iPhone,"The iPhone 12 sports a gorgeous design, full 5G support, great cameras and strong performance. However, the limited base storage is a drawback even at its new reduced price.👍Beyond adding 5G, Apple has equipped the iPhone 12 family with its powerful new A14 Bionic processor, a Super Retina XDR display, a more durable Ceramic Shield front cover, and a MagSafe feature for more reliable wireless charging, and support for attachable accessories.Pros+Attractive new design with MagSafe👍+Comprehensive 5G coverage👍+Impressive dual cameras👍+Fastest performance in this price range👍+Solid battery life👍Cons-Lacks 120Hz display (minor)-No optical zoomApart of this it’s design can win ur heart at first look, Ratina X display is awesome & if you r using iPhone 11 or later then there is significant improvement in terms of sound, display & weight, it is too skinnyFor me this is most sexiest phone ever 👍",64,RED,YES,4,Positive
Happy,Migrating from iPhone SE first generation to iPhone 12. Pleasant experience. One star less why because delivery was inordinately delayed.,64,RED,YES,4,Positive
iPhone is best,iPhone is best and camera quality is awesome 🤩 but neither Amazon did not gave me 1000 cash back of BBD nor their support agent help me to resolve the issue they just open a ticket that no one responds.However iPhone is awesome trust me.,64,RED,YES,4,Positive
All okay except battery,"The product is  original and I\'m completely satisfied with the size, before I thought  mini would  be cute and compact but as an android  user i feel 12 is compact and a little  bit smaller than norml android phones. Also the stock keyboard is very small so I use swift keyboard  so if you are planning  for mini  please  reconsider  your  thoughtsPros: Camera, Video, Audio, build quality, DisplayCons: Small keyboard, Going to previous screen is not easy like android, Case cover is must because  smudge comes easy in backside, Little  bit feeling hotter than Android.Update: After using it for a week, the battery is very very bad in ios 16, an android user will not feel good.But I use it on table, so it\'s not a problem for me. If I decide to use it for outdoor video recording, I\'ll definetly buy a powerbank, otherwise this will be a disaster.",64,RED,YES,4,Negative
Apple-Iphone is the best !!,Apple-Iphone is the best !!,64,RED,YES,4,Positive
99.99% Perfect Smartphone !!,Nicely packed !! Kudos to seller !!I was very much confused between iphone 11 and this one as the price of iphone dropped ... But i am glad i chose this over iphone 11.1.Display:Main upgrade in iphone 12 is the oled display. Boy o boy the screen is amazing. I have user many android flagship\'s but this beats them all.2.Battery:Battery is amazing. I am getting 1.5 days of battery life with my usage.PS: i dont play games.3.IOS:This is my 1st iphone and the experience with ios is great ... Very smooth animations ..even though its not 90hz screen but everything is buttery smooth.4. Camera:The pics from this phone is superb. FLAGSHIP LEVEL CAMERA! You will not be dissapointed.5 Build &Design :This phone looks and feels very premium compared to other phones.Very comfotable to use.6.Face Id:Face id works very fast and accurate in low lighting conditions.7.Updates:Ios14 is good and we can expect another 4yrs of software  updates thats huge !Cons:1.Priced very high but it may be because of high taxes and custom duty.2.No charger and earpods in the box.3.Notifications are a mess ...android is better in managing new notifications.Overall a great Phone IF You are OK with the Price !!!,64,RED,YES,3,Positive
Deffect,Got a little bit of deffect in camera bump but its hardly noticeable,64,RED,YES,3.5,Negative
Battery backup issue,I like camera but battery backup issue,64,RED,YES,4,Average
Heating problem,Bahut heat Hota Hai normal hone ke liye 2 hours without use phone rkhana hoga  aur normal use kro phir bhi heat hota hai Darshita  Electronics seller Ka to product Kabhi life Me mat lena log defect product selling krta hai mare sath aeisa huaa hai,64,RED,YES,4,Positive
All good,I think the packaging need to improve more. Coz the phone was just coming in a simple package without any safety covers,64,RED,YES,4,Positive
Didnt like the product. Not using it,Didnt like the product. Android is the best. 1. Issue in data transfer. 2. Camera is mirror image not like Android. Apple store asking money to transfer data. I made a mistake to buy this,64,RED,YES,4,Positive
Very good,Very good,64,RED,YES,4,Positive
"its 100% original product, fully satisfied with product and delivery so thank you amazon ❤️❤️",The media could not be loaded.                                                                                             I think this is the best way to afford best phones by amazon company so i thank to amazon for providing original products and more good servicers to provide best sales and delivery offers so thank you im so glad to have this season of sale that makes me happiest year thank you......,64,RED,YES,4.5,Positive
As expected,Hearing loss when talking on the phone.,64,RED,YES,5,Average
Except battery everything is fine,Battery drains very fast . As all iPhone Camera quality is gud.Compact size..But not happy with battery backup,64,RED,YES,5,Negative
Best under 50k,Best cameraTop notch hardware and softwareVery smooth experienceDisappointed  by battery life only getting SOT of 9-10hrs although if you are not a heavy user it can easily last 1 day,64,RED,YES,5,Positive
iphone 12 product red,im writing this review after the 2 months of usage its my dream come trueyes its iphone 12 product red(24 hrs delivery) got it from Amazonthough i got 64gb but its great mobile ever.desing is as 5s and over all performances is damn good.battery as all the iphone users knw very well so need not to explain.,64,RED,YES,5,Positive
Best,Very good,64,RED,YES,5,Positive
Amazing apple product,"Very nice device for gaming, photo graphs, making video and easy to use i am happy with my amazing phone",64,RED,YES,5,Positive
Premium feel and reliable,"Phone is perfect, the look and feel is premium. drawbacks according to me :is not having always on display and notification light at this price.As i switched from android i am not able to use third party apps like YouTube vanced , spotify premium and other good side apps.",64,RED,YES,4,Positive
Awesome phone!!,"Very nice and smooth phone, faster and secured too. Display is so great.",64,RED,YES,4,Positive
Good phone,Camera is good nd colour also good,64,RED,YES,4,Positive
Got it safely.,"I got the 256gb variant for just 56.5k as I ordered it on 22nd sep and the prices had already dropped at 11:56pm, the sad part is that they keep increasing the price from the first day only. 6 days later, the price is now 62k. It came safely and works well. Always record an unboxing video and ask the derivery person to wait if possible (I didn’t make him wait in my case, just recorded unboxing). I checked everything and the serial no. on the apple site. I’ gonna use it in my mbbs journey that is about to start soon and I’m so glad. I was worried first because I had ordered my ipad pro in 2020 from the official site only and I have a hard time trusting online retailers for buying electronics but thankfully it’s authentic. Be careful and good luck guys!",64,RED,YES,5,Positive
i phone 12 128 gb,very nice phone and delivery was very good and packing was very good  and safe delivery and good experience  value  of money👍,64,RED,YES,5,Positive
Good phone,"It’s good phone but for the new user, especially android user it’s difficult to use for few days.Apple does not provide any accessoriesThe cable it provides doesn’t work on normal adopter. You need to buy one.Add price of these adopter and headphone also to the phone.",64,RED,YES,5,Positive
Value for money if u are buying it with offers and deals,"The media could not be loaded.                                                                                             Value for money iphone in 2022, only if you are getting it on offers and deals otherwise you have to pay 8-10k more as its original price. I buy it in “great indian festival” sale under prime membership on 23sep. Mid night prior access.Under 41k with HDFC credit card without any card offer .",64,RED,YES,4,Positive
Super,Good,64,RED,YES,4.5,Positive
Camera awesome 👍👍,Very good mobile ...camera quality is superup,64,RED,YES,5,Positive
Great Purchase in great indian sale 2022,I am not a fanboy of apple but just wanna try apple phone at once and its a first day review. Mobile looks good and very handy to use it. Price is always high of apple products but I purchased this at 44k without charger. Great Purchase and I will edit my review after one month of use. Thanks amazon.,64,RED,YES,5,Positive
battery,battery not up to the mark,64,RED,YES,4,Average
Nice product,It’s simply awesome ❤️,64,RED,YES,4,Positive
Very smooth interface to use and brilliant screen.,"Apple at its best, as usual. But Battery life could have been better.",64,RED,YES,5,Positive
Camera is decent but battery is not upto the mark  for heavy users,"Pros- decent camera, display is amazing, phone is compact and handy.Cons- battery is not upto the mark, phone heats up when multitasking",64,RED,YES,5,Positive
"It’s just like any other Android phone, it’s boring.",Boring phone.,64,RED,YES,5,Negative
"It's awesome. Camera is good, battery is one whole day. Performance is top notch.","Phone came after 7 days, with amazon sealed package. Always check the number.Phone condition is good. No bubble wrap or card board boxwas provided. It also help me to identify the box over the package.It\'s a beast. Good looking.Camera_ for me it\'s awesome till now.Performance_ Top notch, just within a millisecond.Battery_ a whole day with no issue.Design- it\'s too good.",64,RED,YES,4,Positive
Great,"The product is great and it works great but the delivery time was very long. I had to wait approx 2 weeks to get a hand of it even after i stay near delhi. no complaints about the product though, just the delivery time.",64,RED,YES,4.5,Positive
heating issue,IPhone 12 is very good butreason for giving four stars because Gets hit even in light use,64,RED,YES,5,Positive
Fantastic Mobile.....,"I have moved from Android to IOS for the first time. Really its a great upgrade and a totally different experience.Phone is great in all the aspects like Display, Battery Life, Call Quality, Awesome Camera.....Beaware of all those rumours that we can\'t download anything from G Drive or can\'t move WhatsApp Chat Backup etc. Everything is possible and in IOS there is a specific steps to follow.If you are Android user and willing to switch/upgrade to IOS then you are most Welcome.Iphone 12 meets all your day to day requirements and in the budget of 40k its a beast.....",64,RED,YES,5,Positive
Weak Battery,Battery is weak.Everything else is good,64,RED,YES,4,Positive
Beast,"This is not an exaggerated review. I have used Xperia, Pixel, and iPhone most of the time. So far I have used Xperia Z/X/Z3 compact, Pixel 2/3/4A, iPhone 8/XR/11 and now using this iPhone 12.In my opinion, this is the best phone I have ever used and it is one of the best smartphones available in the market, even in 2022.Pros: Great display, buttery smooth performance, excellent RAM management, iCloud services, camera, and of course battery life. Initially, I was worried because of the battery life. Because on paper it is just a 2815 mAh battery. But the way the A14 chip manages the performance and battery is spectacular.Cons: No telephone lens. Though I hardly require it (but this is the only cons I think it has).",64,RED,YES,4,Positive
Charm,Shifted from Driod to Apple and it’s worth it … now I know what these crazy apple lovers were harping all about .. now I know … hahaExpensive though … but for me it came as a gift … sooo yeahGo for it,64,RED,YES,5,Negative
Best phone,"Me being an android user switched to IOS coz get iPhone experience … with just 48k iPhone 12 64 gb must phone to buy because it’s performance is super awesome,camera is good,battery backup should’ve increase to 4000 mah at least but I’m supprised with just 2815 mah it lasts 1 day to few more hours,it’s quick responsiveness is pretty good…Overall awesome phone 😍",64,RED,YES,5,Positive
Good Performance,"I have only one dislike, if the phone is off and the phone rings there no option to decline the call. As you know I am a new iPhone user. I have brought an iPhone for the very first time. So, it will take time for me to get used for it. But the camera quality and battery life has shown a sudden improvement. Thank you apple.",64,RED,YES,5,Positive
Quality +Delivery Fantastic!👍,"The media could not be loaded.                                                                                             Delivery was very greatYou trust on this seller I have get this product in good time, delivery boy was very polite,fast working, everything was greatBut you should add free charger",64,RED,YES,4,Positive
Nice mobile,‘Dehh,64,RED,YES,4.5,Average
Excellent Phone,Battery life is poor. No VoLTE calling. Excellent camera.,64,RED,YES,5,Positive
Product is The packaging of the product is very poor.,Packaging was very poor just corrugated box for iphone. I don\'t happy with it. Product can damage with this type packaging.,64,RED,YES,5,Positive
Nice quality product ❤️,The media could not be loaded.                                                                                             Perfect,64,RED,YES,4,Positive
Basic accessories are missed,Basic Accessories should be given by the company .... atleast chargeroverall it is ok,64,RED,YES,4,Positive
Awesome 👍,Very nice 👍,64,RED,YES,5,Positive
Premium phone with poor battery and average camera,I have upgraded from four years old iPhone 7.Only noticeable change is screen size and face unlocking.Camera doesn’t adjust exposure properly and I must say not much better from iPhone7.Let’s bear this for next 4-5 years 😊,64,RED,YES,5,Negative
Battery giving problem,Not happy,64,RED,YES,5,Negative
In hand feel Premium phone,"I am worried about delivery what\'s happened in my case because so many negative review and bettries issue but trust me guys when i open the box product is genuine and now blindly trust on Amazon delivery.Any i am using after 3 days phone my review is so called people complaint about bettery but trust me guys i am using 8-9 hours heavy use with out any heat and battery sudden drain if you use long time phone without battery drain, go to settings and general nd off background application use.Display and looks classy when i go to shop apply tuffon glasss all other person just see the phone and me😂Thanks Amazon",64,RED,YES,4,Negative
iPhone the name is enough,It’s been a week using iPhone 12 I booked on 12:02am on prime day sale I got delivered morning after 11 am super fast delivery . First time iPhone user I had some difficulty getting to it but now fine  The battery backup i av to say one of the best being a heavy user lets say i charged up to 97% removed charger at 9am the time I am posting this I av remaining 57% at time 7:55pm. And I believe you all want to know about battery backup other things about iPhone ever kids knows so that’s it one of them best iPhone. Remember go for minimum 128 GB version,64,RED,YES,4.5,Positive
Apple is above all,Premium feel,64,RED,YES,5,Average
It’s iPhone simply the best,Am user of iPhone since last 8 yrs so no regrets on upgrading to this one. Video is far excellent and build quality is superb. Have an android phone and don’t feel like using it,64,RED,YES,5,Positive
One of the best phone,Honest review after one month of purchaseI have purchased this in diwali sale in only 51990. And the phone is awesome looking best.The battery life is good.This is the one of the best phone. I bought from darshita electronics on Amazon this is the best and trusted seller on Amazon.,64,RED,YES,3.5,Positive
Build and processor is so solid,iPhone is a dream product for a middle class family and not esey to buyBut if you buy itt it’s not disappoint you in any criteria,64,RED,YES,4,Average
Beyond Expectations,"With soo many innovations in Iphone series, i did not expect this one to be soo great.I love it, the midnight black colour is lovely. With the Face ID features and quick access to all the apps in App Store, this series is a must buy.",64,RED,YES,4,Positive
Average,Like style lookDislike camera,64,RED,YES,4,Average
iPhone 12 ...order from amazon.....fully satisfy from delivery and product. Great job amazon...👍,iPhone 12 ...best deal in 2022...you can also go for this ..no issue ..excellent experience with iphone 12.,64,RED,YES,4,Average
Best performance and camera,"Performance - It has very good performance, ram management is too much goodCamera - Camera performance in day light is awesome and in night is also very good. Video quality is unbelievable, video stability is wonderful.Battery - battery is not too good, not running whole day if we use heavily. Average backup 10 to 12 hours .",64,RED,YES,4,Positive
Good value of money iPhone,What I like:-1. Software experience2. compact design3. camera qualityWhat I don\'t like:1. touch response2. screen refresh rate3. battery backup4. overheat when charged with apple original 20 watt,64,RED,YES,4.5,Positive
iPhone craze,"Camera is good, battery should have been an issue for prolonged screen users",64,RED,YES,5,Positive
