100% genuine product received from Amazon.,"I am glad to buy this phone in just 41500rs it was a amazing deal.There is no scam or no fake product this is 100% genuine if your budget allows go for it no doubt , you will thank me later 😊❤️",64,RED,YES,4,Positive
Raj,Nice,64,RED,YES,4.5,Positive
Bad amazon delivry,"Mobile ke box ko ek polythin me bhar kar bijwa diya gaya,,isse uski sefty me fark nahi pada hoga.. amazo delivry  bad ,,,,But mobile good camera battery speed good 👍 good",64,RED,YES,5,Positive
Delivery so late & Delivery boy Very Rude,Product fine & Original but delivery is so lateBeware of Delivery person,64,RED,YES,5,Positive
"Purple is the new gold, best iphone after iphone 6","Best phone to get into Apple world and it looks good for at least 3 years..😊 go for it others than some extra battery life in iphone 13 and 14 there is not much difference with iphone 12,Cons: migrating WhatsApp from Android is not supportee, true caller doesn\'t work in iphone , annoying icloud storage notifications.",64,RED,YES,4,Positive
It’s fine but packaging was very lose since it’s a expensive stuff one should tc of this,The media could not be loaded.,64,RED,YES,4,Average
Nice phon good look nice display,Nice phon nice battery backup Nice display,64,RED,YES,5,Positive
Amazon process and iPhone,It is really existing me for iPhone 12 platform and yes this is worthy for putting money for 128 gb as per Amazon offer. In terms of Amazon offers and services it’s really satisfactory.Secondly in respect towards products it’s good.,64,RED,YES,5,Positive
Best in class !,As you all know no one can beat the quality of Apple. Got this phone for cheaper price in the great India sale. Packing and all was also good and the delivery was done before time.,64,RED,YES,5,Positive
Thank you,"I usually don’t write reviews. But, I should appreciate that the product you have sent is genuine and good. Overall IPhone 12 has battery issue after software update.",64,RED,YES,4,Positive
Good phone,Very good work,64,RED,YES,4.5,Positive
The best,The best at the price of 40k,64,RED,YES,5,Positive
Amazing quality,Minimize/reopen feature is not looks good/ overall nice phone,64,RED,YES,5,Positive
Looks Good.,"Product is good.But, delivery process needs to be improved.",64,RED,YES,3.5,Average
Package not sealed!!,"The iPhone plastic seal just before opening your iphone box was open, it was not sealed!! Very disappointed about that, when you buy 50k worth phone and it doesn\'t even come properly sealed. The plastic cover was not sealed in that case anything could have happened to my phone there is no guarantee that it was even a new phone. It should be sealed!!!! Seller please do not do this to any other buyer. It\'s very disappointing.It got me very worried so i check everything. IMEI, model no., Serial no. on apple website, Siri, etc... Anyways so far everything matched... so little relief.BUT HONESTLY SENDING OPENED PACKAGE WAS VERY DISAPPOINTING!!! HOW WOULD THEBUYER EVER TRUST IF AN OPENED PACKAGE IS SENT.",64,RED,YES,4,Negative
Battery backup,I phone hai bhai iaska kya hi mukabla. Mast hai bas battery backup ka hi issue rehta haj iasma,64,RED,YES,4,Average
A better blackberry,IPhone is about to meet the fate of blackberry. A privacy based phone alone can’t survive in this era of fast changing world. We have seen it with blackberry. IOS UI feels like you are in Stone Age. But you will be happy with unwanted ads not popping up in your screen or on your screensaver. But the time will come when you will see ads soon in your iPhone too coz there’s huge money involved. Lots of customisation is required in UI to smoothen the functional use. There isn’t any drastic changes since. If you are fed up with android ads and privacy issues go for iPhone. But it wouldn’t be easy as you would feel like using a Samsung S1. 10years old,64,RED,YES,4,Positive
Camera - Night Face Recognition to open screen lock is brillient,"Hey Siri Option to make a call is good, Camera Quality is excellent, Night Photo is Good to capture.",64,RED,YES,4,Positive
Value for money.Excellent phone,Very smart and fast phone . Battery life is very long and face recognition is very fast with mask as well as without mask,64,RED,YES,4,Positive
Super phone,Good phone and value for money,64,RED,YES,4.5,Positive
100% pesa vasul,Like,64,RED,YES,5,Average
Nice product,Product is good and nice camera quality.tnx amazon,64,RED,YES,5,Positive
Apple iPhone 12 128 GB white,"First iPhone from Amazon,  wonderful experience 👍😍",64,RED,YES,5,Positive
Just Go for it..,The best Apple iPhone …worth it 12,64,RED,YES,5,Positive
Don’t go for it just came for it😂,Nice product,64,RED,YES,5,Positive
Good but overhyped,The media could not be loaded.                                                                                 The product is good for business and work but as a normal usage it is pretty overpriced I\'ve found better devices cheaper than this the honest thing I\'d say is it is good but overpriced if you wanna purchase it go ahead it\'s  really smooth and water resistant  if you are willing to buy it I\'d recommend,64,RED,YES,5,Positive
Nice,Good product,64,RED,YES,4,Positive
It is good for working,Battery no good and everything is good,64,RED,YES,4,Positive
Camera,The media could not be loaded.                                                                                 Good,64,RED,YES,4,Positive
After using 1 month. I feel happy to buy this product thanku amazone it's trustable .go for it,Only battery backup is low but all good.,64,RED,YES,5,Positive
There is nothing to review On Iphone!!,Iphone is good nothing to review but still I want to mention….Camera is awesome as usual I love it,64,RED,YES,5,Positive
iPhone is after all an iPhone,Perfect phone for unheavy user.,64,RED,YES,5,Positive
Superb ...,Nice product,64,RED,YES,4,Positive
Just loved it 🥰,Socho mat bss kharid lo full satisfied 😌😌,64,RED,YES,4.5,Positive
Right product for value of money,perfect product and excellent,64,RED,YES,5,Positive
Excellent product,One of the best iPhone I have used very smooth. For using superb amazing product,64,RED,YES,5,Positive
first iPhone but happy evrythngin phone is premium. Feeling special having it in my hand. Loved it.,Great,64,RED,YES,4,Positive
iPhone 12 ❤️‍🔥🤤🤤🤤🥰,Zeher 🥰🥰🥰🫵🫵🫵🤤❤️‍🔥I’m fida ❤️‍🔥👌 bhai Khatarnak  hai 👌🤤🤤,64,RED,YES,4,Average
I am little bit confuse about the size. Iphone 12 or mini i had bought!!!,Phone is excellent,64,RED,YES,5,Positive
Worthy as expected,Include adopter with mobile other wise it is useless,64,RED,YES,5,Positive
Good,Good,64,RED,YES,5,Positive
Packing was a little bit poor in the sense your packing an iphone,I like this photo camera but battery life is decent,64,RED,YES,4,Positive
Excellent product,Excellent product not so good packing,64,RED,YES,4.5,Positive
Great phone,"It a great product as there is no big change in iphone 13,14 not the major so best 5g iphone at affordable price",64,RED,YES,5,Positive
If you want to experience the ios(Tight budget) go for it if you want to showoff Don't,It\'s still worth to buy in 2022 go for it without any doubt and if you want to experience the ios but you have a target budget to spend otherwise if you want to showoff or no limit t spend go for the latest models like 13 or 14 :),64,RED,YES,5,Positive
look,got a lifetime patner,64,RED,YES,4,Average
Little bit costly,Thik hai ab i Phn h Kya Hi Kahe,64,RED,YES,4,Average
Good,Almost Good,64,RED,YES,5,Positive
Incredible phone,"It’s my first ever iPhone switching from Android to iOS is slightly difficult but it takes only 2 to 3 days to understand and I am used to it , Awesome camera quality smooth and buttery touch experience great security overall you cannot compare this with Android. Go for it .",64,RED,YES,5,Positive
Good,It’s so good,64,RED,YES,5,Positive
O,Ok,64,RED,YES,4,Positive
Best selling phone in the world!!!,"No wonder Apple makes some of the best phones in the world. Iphone 12 deservedly is the highest selling phone.I was upgrading from iphone 7 which served me well for 4 years, which I exchanged for this.The delivery & exchange formalities were smooth.The phone itself is surely an upgrade when compared to 7, the display is top notch, the camera is probably the best there is, the face unlock works like a charm, what\'s to say about the best phone, it works even better than advertised.The only problem like always is the battery which hardly lasts a day & charging time is also an issue, it tends to heat up a little while charging but with the previous experience with iphone 7, the longevity of the phone is guaranteed with the timely updates from Apple, the premium which an iphone demands stands justified with a superior product.Some people tried to discourage me from buying an iphone from Amazon claiming warranty & support issues. But there\'s no substance to such things. I confirmed the warranty & product registration from Apple, it\'s as advertised.Since most of us are going to use it for a longer period of time, it\'s prudent to opt for the extended warranty offered by Apple which costs around 16500 which gives us an extended year of warranty. Do remember to do this within 3 months of your purchase.",64,RED,YES,4.5,Positive
Very good phoen,The media could not be loaded.                                                                                             Excellent phoenBut battery back not goodOtherwise excellent,64,RED,YES,5,Positive
I Phone,"Nice Apple Phone , Value For Money",64,RED,YES,5,Positive
Worth the experience,"Touch, camera, performance is top notch as u would expect. If you switch to iPhone trust me you won’t use any android phones again.",64,RED,YES,4,Positive
The Perfect product received Original one.,The Perfect product received Original one.Thanks Amazon,64,RED,YES,4,Positive
Brand always speaks,"Worth for money, i bought it under sale , its value for every penny spend",64,RED,YES,5,Positive
"Great camera 🤳 quality, very fast performance in bgmi",Its a great movement for me because it is first time to to believe in ios but i am successfuly satisfied camera quality and build quality is awesome . thankyou sooo much Amazon,64,RED,YES,5,Positive
iPhone 12  hitting issue,Hitting issue after update 16 iOS same problem,64,RED,YES,5,Average
"Great product, slow delivery, almost delivered in 1 month","This is my sixth iPhone : started from 3g, 4, 5s, SE, iPhone 7, iPhone 11 and this one. Received the product after one month, no complaints about the product",64,RED,YES,4,Average
Battery drain,Awesome product thank you,64,RED,YES,4.5,Positive
Jo quality apple de skta hai na wo or koi nhi Dee skta ❤️,Osssmmmm but Android se iOS main Ane m dikt to hoti h but feeling Aasman touch kr jatti hai i phn hat 😎main hone k bad 🔥,64,RED,YES,5,Negative
Doubts on packaging of original iPhone,"I doubt on packaging of iPhone box, as what we get packed at Apple retail shops.",64,RED,YES,5,Average
Amazing product 👍,Amazing product,64,RED,YES,5,Positive
Camera is not up to the mark,"Very smooth, good sound quality, good display, I found camera of this phone very noisy",64,RED,YES,5,Positive
A lot better than expected!,"iOS has been an amazing shift from android. The Apple ecosystem is literally the best in the market. Everything is just so smooth and every device is a lot more connected when compared to an android ecosystem. The amount of attention Apple pays to small details is insane, everything is just perfect to my eyes.",64,RED,YES,5,Positive
Tq so much Amazon,I Love this😘,64,RED,YES,5,Positive
"Camera is good , battery life is average",Battery life is average and camera is good,64,RED,YES,5,Positive
Good,Good,64,RED,YES,5,Positive
Bad batty life,Battery life Avrej,64,RED,YES,5,Average
Happy,Jb aap kuch nhi kr rhi ho to hi iPhone le or students ke liye iPhone nhi he,64,RED,YES,5,Average
Flawless,"Best choice ever,night mode is next level",64,RED,YES,5,Positive
Worst Battery Life,Everything is perfect but can\'t even use for 1 day with that battery life worst...,64,RED,YES,5,Average
Amazing,This phone is my transition from Android to ios and my experience is amazing. Thank you Amazon,64,RED,YES,5,Positive
"Very nice product, only issue of colour not same as  like shown in picture,","Good 👍, thanks to Amazon",64,RED,YES,5,Positive
You will need a case & a screen guard,Poor build quality,64,RED,YES,5,Negative
Awesome,Very good decision to go with apple over available android phones. Really very happy.,64,RED,YES,5,Positive
iPhone 12,The media could not be loaded.                                                                                             1st time switching from Android to iOS...Nice phone.. nice camera,64,RED,YES,4,Positive
Best Buy for 43k,Love the phone. Got it at a reasonable rate compared to 13. Love how smooth it is to switch between tabs without glitches. Switched from android and have not been disappointed.But I do feel it’s better to get the 128gb version. Now I’m paying 75₹ per month for 50gb icloud.,64,RED,YES,4,Positive
Very good satisfied the buy from Amazon it's authentic,Good buy,64,RED,YES,5,Positive
Nice,"I always find good, no phone can better then iPhone",64,RED,YES,5,Positive
Small but powerful,I liked it. Enough battery for me a little bit heating issues I face but it will be solved by the updates I think,64,RED,YES,5,Positive
My First iPhone,Switch from Android to iOS felt good and away from all those ads filled apps. A very refined phone and after the iPhone I actually started using the mobile phone as a phone only. My screen time had come down and feeling a lot more professional with an iPhone in my hands. Seriously…!!,64,RED,YES,5,Positive
Very good experience,It was really smooth buying it from Amazon. Price was the best and delivery in less than 12 hours. What else can one ask for.,64,RED,YES,5,Positive
Battery performance is little poor,Great product,64,RED,YES,4,Positive
PERFECTION!,I LOVE THIS IPHONE I BOUGHT IT FOR MY FRIEND\'S SISTER I HAVE IPHONE 13APPLE IS BEST <3,64,RED,YES,4,Positive
everything is fine other than battery,"this is my first IOS device, even though it is a 60hz display it is very smooth its feel like a 90hz, camera is decent portrait mode is not good as expected, gaming performance is very good and no lags and framedrops, but the only issue i faced is battery life, even you are a normal user you will get screen time of 5 hr 30 min, but im a heavy user i need to charge it twice in a day, stereo speakers are also nice. my overall rating is 3.5/5",64,RED,YES,5,Positive
Amazing!!!,"It’s my first iPhone ever and I bought it with my earned money through part time jobs in college✌️I am a tech freak so you can trust my views -- A14 Bionic is the fastest, most efficient and reliable processor till date- The camera focuses so quickly that you can take DSLR quality photos.- The screen size 6.1 inches is the most comfortable screen size out there and the OLED retina XDR display is so crisp and everything feels real.- The stereo speakers are so clear even on high volume and gives awesome vibe while listening to music- iOS has no bugs at all- 20W charging is lit 🔥- The Face ID feels like having no lock for yourself, there’s no issue while using Face ID even in the dark because it uses infrared rays to scan the faceDrawbacks -- Battery could be better",64,RED,YES,5,Positive
Hi just to update that have a received the internal phone packet without shield packed,The media could not be loaded.,64,RED,YES,5,Average
Awesome purchase but i wish i had purchased it earlier in sale..,Size is a bit small because i have used xr..but its lighter than xr.,64,RED,YES,4,Negative
Non performing battery life issue still continues with IPhone,I moved from IPhone 7 to 12 expecting the battery life to be much better but seems apple didn’t work much on improving battery life so not much satisfied after spending much to buy and upgrade,64,RED,YES,5,Positive
Receive genuine product (iPhone 12),The media could not be loaded.                                                                                             I get this on 25 September and I write this review after 7 days . Using from 7 day I face no issue in iPhone 12 and I get genuine product( no dent no scratches) camera is awesome and for performance I have no words (beast)But i not satisfy from packing by AmazonOverall I am very happy with iPhone 12 .If any one think to buy go for it.Thank you,64,RED,YES,5,Positive
Great Product,iPhone at it\'s best.,64,RED,YES,5,Positive
Good product,It is the first time I am using I phone .I have a pleasant feeling and looking forward for future products,64,RED,YES,5,Positive
Great phone,Its better than iphone13 When compared on price point very negligible differences for a normal user.Battery life- lasts 1day( i am having avg 6-8hr screentime)Camera- as everyone knows top notch.User experience- As a android user for long years. This ios experience is just great. Now i understand why many prefer ios.Face recognition- works wellUpdates- as per my knowledge it supports till 2027. And currently eagerly waiting for ios16 release. U can check youtube videos of ios16 features. Much more features coming on software side.,64,RED,YES,5,Positive
Good phone... but???,"It is not bad as it should for the amount you shell out to buy it. I am having a little issue though, the lightning cable that came with the phone has stopped working in less than 2 months.  So that makes you question if the product is really worth it. does the make and quality justify the price?",64,RED,YES,4,Positive
Superb,Liked it so much,64,RED,YES,4,Positive
Kickless,I prefer Samsung is the best one.,64,RED,YES,5,Positive
Very happy with the experience,I like everything about the phone and it is very very smooth I want to continue with iphone this is my first iphone I\'m not so much interested in it but I give it try and it\'s nice and beautiful phone  and smooth to use,64,RED,YES,5,Positive
Kidney as a Service (KaaS),"Everything is good so far. But, it needs to be taken care with the extra attention.You may buy this phone, if below points are considerable for you -• Back Camera - Crystal clear with 4K @60 FPS (I would say, just X-ray technology is missing in it and I trust Apple will even add it in it’s upcoming devices.)• Front Camera - Excellent/Very bad (Very bad: because, few Papa ki Pari/Paraa kind of peoples would certainly hate this camera as this captures everything on your face. So, filters are highly unexpected using the main camera. Though, filter apps can be used.)• Battery - Excellent/Bad (Bad: For those who are expecting to buy this device for hardcore gaming purpose as it drains so fast.)• Performance - Excellent (No comments)",64,RED,YES,5,Negative
Different experience from android,Once you buy it you will feel the complete difference between android and ios. Ios is far better and no where comparable with android,64,RED,YES,4,Positive
Great pic at low Cost,"Camera is good , But need some improvement in Battery backup, as usually iOS superb...",64,RED,YES,4,Positive
As expected,As expected,64,RED,YES,5,Negative
"Liked the phone, and performance of the os","Phone is in very good condition as if you buy from offline market , surely relly on Amazon for product no bias review personal experience, though it was late delivered but nicely delivered. I hope Amazon would gain more customers through their this type of customer experience.",64,RED,YES,5,Positive
And it’s an iPhone,Always best the iPhone 12 design and look,64,RED,YES,5,Positive
iPhone 12 is a better option,Everything is best but somewhere the battery have to be improve,64,RED,YES,4,Positive
Value for money,Value for money. Same as shown in picture.,64,RED,YES,4.5,Average
the best phone ever,the best phone i have ever purchased,64,RED,YES,5,Positive
A good device. But a lot of unnecessary hassles involved to get the most basic things done.,"Don not buy an iPhone if you need things done smoothly. Most day to day tasks will be smooth. But as soon as you decide to transfer files or send original quality photos, you\'ll have to go through a lot of different steps to get that done. The sheer peace of mind a person using Android has, an iPhone user doesn\'t. Unless the user doesn\'t care about quality of photos, sharing, etc.",64,RED,YES,5,Positive
Pocket size dynamite,Best iphone to buy in 2022.I was a android user.the only thing that i dont like in iphone is battery backup overall its a beast.Now i use iphone as my primary device and android as secondry.no words to say i am just enjoying my iphone.,64,RED,YES,4,Positive
...,Really nice xpriyance with this order good packing and phone was delivered good condition *************************************,64,RED,YES,4,Positive
Nice product,Good,64,RED,YES,5,Positive
Nice to hold!!!,I liked it so much!!!Very cool product .,64,RED,YES,5,Positive
Genuine product,"Genuine product , you can trust flipkart for smart phones",64,RED,YES,5,Positive
Good phone,Camera good,64,RED,YES,4,Positive
Good buy.,Excellent phone and worth buying.,64,RED,YES,4.5,Positive
"Iphone is best ever, no one brand can comparable with iPhone’s Devices.","Iphone is best ever, no one brand can comparable with iPhone’s Devices.",64,RED,YES,5,Positive
Don’t go on the negative reviews. The product is amazing,"Upgraded from iPhone 8 . Was worried a little to buy online .The phone is amazing not a single scratch or damaged .All the features work flawlesslySyncing from iPhone to iPhone is so easy . The phone itself recognises that we have upgraded to a new phoneUsing Apple watch 5 with this , which works superbly well.The product does not provide charger adapter and earphones thats a cons I felt.Bought Boat Airdopes 161 which works great on it , with good base and sound as well.",64,RED,YES,5,Positive
Not Too good in battery life and Zooming camera,The media could not be loaded.,64,RED,YES,4,Average
Genuine phone,Only drawback is battery life,64,RED,YES,4,Average
Astonishing!!!!,"I’ll write a review later, but in short, from a hardcore android user’s view, iOS is goood! But you still cannot live without android lol, but i have literally no complaints about this phone, everything gets a big thumbs up.",64,RED,YES,5,Positive
Awesome,I have most likely phone,64,RED,YES,5,Positive
Its Apple,Wonderful camera Quality !,64,RED,YES,5,Positive
Overall good but small screen size,iPhone is good but small screen size compared to android and worest notch.,64,RED,YES,4,Positive
Good product,Video&Music,64,RED,YES,4,Average
Black color is very pretty 🦋,The media could not be loaded.                                                                                             Black is very shiny,64,RED,YES,5,Positive
Best Phone,"I switched to ios from android and was amazing to use this phone.Camera is super,battery life is super,ram management is amazing,in hand hold is awesome.",64,RED,YES,5,Positive
Best phone ever in 53k prices,No doubt apple iphone is good but as a first time users apple should provide a charger.,64,RED,YES,5,Positive
As always iPhones are Amazing,Little disappointed about battery backup else everything is just amazing.,64,RED,YES,4,Negative
Super,The media could not be loaded.,64,RED,YES,4.5,Average
Time taking delivery,The delivery was time taking as hell! But the mobile was safely delivered… If you van afford then buy i phone 13 it have more peak brightness than 12,64,RED,YES,5,Positive
A happy product,"No open box delivery, but we really trust amazon.in. Nothing much to say, people are quite aware of apple products. Simply awesome",64,RED,YES,5,Positive
Beast phone.loving it.,"Beast phone. I\'m writing this review after 3 days of use. This is the first time i am switching from Android to ios (iphone 12) and i am loving the overall experience. First of all i was a lil sceptical about buying an expensive phone online. But after so much of research and asking friends I have ordered the phone. And now after unboxing and using it for 3-4 days, I can surely rely on online purchase. Amazon delivered a good genuine product. I\'ve also bought it during a sale on Amazon so got a good deal. Overall a very very good experience. Highly recommend.",64,RED,YES,4,Positive
I am satisfied with my iPhone's camera video quality and other functions,I am satisfied with my iPhone\'s camera video quality and other,64,RED,YES,4,Positive
Apple should wait for at least 2 years before launching a new iPhone.,"Well they are a multinational conglomerate and I have simply purchased a product of theirs, so I shouldn’t be commenting on their product launching strategy. However keeping this aside, I would try to genuinely help those looking for reviews before buying, in a few simple steps.1. Go for it if you are going for an upgrade after  3-4 years, as it will give you some flawless experience again.2. Battery life is not upto the mark, I feel XR that I used before this had a good battery, maybe I am wrong.3. Face ID has got no significant improvement at all, again I think XR had a better face detection.4. Camera I could sense something has been done.5. Coming to interface and product performance, it is flawless, smooth, faster.",64,RED,YES,5,Positive
